{
  "schema_version": "constraint-evaluation-run/v1",
  "run_ref": "synthetic:constraint-run:unknown",
  "retrieval_run_ref": "synthetic:retrieval-run:3",
  "context_digest": "sha256:eeeeeeeeeeeeeeeeeeeeeeeeeeeeeeeeeeeeeeeeeeeeeeeeeeeeeeeeeeeeeeee",
  "raw_context_retained": false,
  "policy_version": "constraint-engine/v1",
  "evaluated_at": "2026-09-01T19:00:00Z",
  "outcome": "ABSTAINED",
  "candidates": [{
    "entity_ref": "variant:103",
    "status": "UNKNOWN",
    "hard_constraints": [{
      "constraint_id": "budget",
      "kind": "BUDGET_MAX",
      "status": "UNKNOWN",
      "reason_code": "price_unknown",
      "evidence_refs": []
    }],
    "preferences": [],
    "reason_codes": ["required_constraint_unknown"]
  }],
  "result_digest": "sha256:ffffffffffffffffffffffffffffffffffffffffffffffffffffffffffffffff"
}
