{
  "schema_version": "constraint-evaluation-run/v1",
  "run_ref": "synthetic:constraint-run:excluded",
  "retrieval_run_ref": "synthetic:retrieval-run:2",
  "context_digest": "sha256:cccccccccccccccccccccccccccccccccccccccccccccccccccccccccccccccc",
  "raw_context_retained": false,
  "policy_version": "constraint-engine/v1",
  "evaluated_at": "2026-09-01T19:00:00Z",
  "outcome": "NO_ELIGIBLE_CANDIDATE",
  "candidates": [{
    "entity_ref": "variant:102",
    "status": "EXCLUDED",
    "hard_constraints": [{
      "constraint_id": "stock",
      "kind": "AVAILABILITY_REQUIRED",
      "status": "UNSATISFIED",
      "reason_code": "availability_unsatisfied",
      "evidence_refs": ["offer-truth:1002"]
    }],
    "preferences": [],
    "reason_codes": ["hard_constraint_unsatisfied"]
  }],
  "result_digest": "sha256:dddddddddddddddddddddddddddddddddddddddddddddddddddddddddddddddd"
}
